{
  "goal": {
    "entity_type": "goal_contract",
    "entity_id": "goal-pump-driver-001",
    "entity_version": 1
  },
  "planning_assessment": {
    "risk_level": "medium",
    "error_cost": "material",
    "task_complexity": "bounded",
    "verifiability": "mixed"
  },
  "budget": {
    "max_model_calls": 8,
    "max_review_cycles": 2,
    "max_tool_calls": 6,
    "max_elapsed_seconds": 1800
  },
  "role_requirements": [
    {
      "role": "orchestrator",
      "minimum_count": 1
    },
    {
      "role": "executor",
      "minimum_count": 1
    },
    {
      "role": "reviewer",
      "minimum_count": 1
    },
    {
      "role": "verifier",
      "minimum_count": 1
    },
    {
      "role": "decision_authority",
      "minimum_count": 1
    },
    {
      "role": "synthesizer",
      "minimum_count": 1
    }
  ],
  "assignments": [
    {
      "slot_id": "orchestrator-primary",
      "role": "orchestrator",
      "role_assignment": {
        "entity_type": "role_assignment",
        "entity_id": "role-assignment-orchestrator-001",
        "entity_version": 1
      },
      "selection_basis": [
        "availability",
        "role_eligibility",
        "data_policy"
      ],
      "responsibilities": [
        "Apply the protocol rules and coordinate the task graph."
      ]
    },
    {
      "slot_id": "executor-primary",
      "role": "executor",
      "role_assignment": {
        "entity_type": "role_assignment",
        "entity_id": "role-assignment-executor-001",
        "entity_version": 1
      },
      "selection_basis": [
        "domain_match",
        "tool_access",
        "role_eligibility"
      ],
      "responsibilities": [
        "Prepare the candidate-selection proposal."
      ]
    },
    {
      "slot_id": "reviewer-independent",
      "role": "reviewer",
      "role_assignment": {
        "entity_type": "role_assignment",
        "entity_id": "role-assignment-reviewer-001",
        "entity_version": 1
      },
      "selection_basis": [
        "domain_match",
        "independence",
        "role_eligibility"
      ],
      "responsibilities": [
        "Review the proposal against the goal constraints."
      ]
    },
    {
      "slot_id": "verifier-primary",
      "role": "verifier",
      "role_assignment": {
        "entity_type": "role_assignment",
        "entity_id": "role-assignment-verifier-001",
        "entity_version": 1
      },
      "selection_basis": [
        "tool_access",
        "independence",
        "role_eligibility"
      ],
      "responsibilities": [
        "Verify the startup-current claim with the fixture rule."
      ]
    },
    {
      "slot_id": "decision-authority-primary",
      "role": "decision_authority",
      "role_assignment": {
        "entity_type": "role_assignment",
        "entity_id": "role-assignment-decision-001",
        "entity_version": 1
      },
      "selection_basis": [
        "independence",
        "role_eligibility",
        "availability"
      ],
      "responsibilities": [
        "Approve or reject the motor-driver selection decision."
      ]
    },
    {
      "slot_id": "synthesizer-primary",
      "role": "synthesizer",
      "role_assignment": {
        "entity_type": "role_assignment",
        "entity_id": "role-assignment-synthesizer-001",
        "entity_version": 1
      },
      "selection_basis": [
        "role_eligibility",
        "cost",
        "latency"
      ],
      "responsibilities": [
        "Produce the final result without altering accepted decisions."
      ]
    }
  ],
  "independence_rules": [
    {
      "rule_id": "reviewer-independent-from-executor",
      "type": "role_separation",
      "role_a": "reviewer",
      "role_b": "executor"
    },
    {
      "rule_id": "decision-independent-from-executor",
      "type": "role_separation",
      "role_a": "decision_authority",
      "role_b": "executor"
    },
    {
      "rule_id": "verifier-independent-from-claim-author",
      "type": "author_separation",
      "reviewing_role": "verifier",
      "target_entity_types": [
        "contribution"
      ],
      "target_contribution_types": [
        "claim"
      ]
    }
  ],
  "selection_basis": [
    "domain_match",
    "tool_access",
    "data_policy",
    "role_eligibility",
    "independence",
    "cost",
    "latency",
    "availability"
  ],
  "selection_rationale": "The material error cost and mixed verification needs require an executor, independent reviewer, verifier, decision authority, and synthesizer within the bounded budget.",
  "decision_authorities": [
    {
      "decision_subject": "motor_driver_selection",
      "role_assignment": {
        "entity_type": "role_assignment",
        "entity_id": "role-assignment-decision-001",
        "entity_version": 1
      }
    }
  ],
  "fallback": {
    "missing_required_role": "awaiting_user",
    "invalidated_assignment": "replan"
  },
  "status": "active"
}
